{
  "$schema": "http://json-schema.org/draft-07/schema#",
  "title": "Simple Git CMS configuration",
  "description": "config.json, which sits next to the editor's index.html.",
  "type": "object",
  "additionalProperties": false,
  "required": [
    "repo",
    "auth",
    "collection",
    "media"
  ],
  "properties": {
    "$schema": {
      "type": "string"
    },
    "title": {
      "type": "string",
      "description": "What the editor calls itself."
    },
    "siteName": {
      "type": "string",
      "description": "The site's name, used as the logo's alt text."
    },
    "logo": {
      "type": "string",
      "description": "An image next to the editor, e.g. ./logo.png. A missing one is simply not shown."
    },
    "lang": {
      "enum": [
        "en",
        "zh",
        "ja"
      ],
      "description": "Starting interface language. Omit it to follow the browser; whatever the person picks from the menu wins."
    },
    "repo": {
      "type": "string",
      "pattern": "^[^/\\s]+/[^/\\s]+$",
      "description": "owner/name of the repository holding the content."
    },
    "branch": {
      "type": "string",
      "default": "main"
    },
    "siteUrl": {
      "type": "string",
      "pattern": "^https?://",
      "description": "The site's address: used for \"View on site\", and to load images when the editor is on another domain."
    },
    "timeZone": {
      "type": "string",
      "default": "Asia/Tokyo",
      "description": "An IANA zone, e.g. Asia/Tokyo. Used for dates shown, image folders and new article ids."
    },
    "auth": {
      "type": "object",
      "additionalProperties": false,
      "required": [
        "base"
      ],
      "properties": {
        "base": {
          "type": "string",
          "pattern": "^(https?://|/)",
          "description": "The sign-in relay's address (see auth/README.md)."
        }
      }
    },
    "collection": {
      "type": "object",
      "additionalProperties": false,
      "required": [
        "dir"
      ],
      "properties": {
        "label": {
          "type": "string",
          "description": "What this collection is called in the interface, e.g. news."
        },
        "imageField": {
          "type": "string",
          "description": "The frontmatter field for the article's cover image, e.g. image. Empty (the default) means no cover image control."
        },
        "dir": {
          "type": "string",
          "description": "The article directory inside the repository; one <id>.md per article."
        },
        "url": {
          "type": "string",
          "pattern": "^/",
          "default": "/{id}/",
          "description": "The article's address on the site. {id} is substituted."
        }
      }
    },
    "media": {
      "type": "object",
      "additionalProperties": false,
      "required": [
        "dir"
      ],
      "properties": {
        "dir": {
          "type": "string",
          "description": "Where images live in the repository, e.g. public/uploads."
        },
        "url": {
          "type": "string",
          "pattern": "^/",
          "default": "/uploads",
          "description": "Their path prefix on the site."
        },
        "maxWidth": {
          "type": "number",
          "minimum": 1,
          "maximum": 10000,
          "description": "Images wider than this are scaled down on upload."
        },
        "quality": {
          "type": "number",
          "minimum": 0,
          "maximum": 1,
          "description": "webp quality, 0 to 1."
        },
        "maxFileMB": {
          "type": "number",
          "minimum": 1,
          "maximum": 100,
          "default": 20,
          "description": "The largest attachment that may be uploaded, in MB. Cloudflare Pages and Workers static assets serve a single file of at most 25 MiB, and GitHub refuses one over 100MB."
        }
      }
    },
    "preview": {
      "type": "object",
      "additionalProperties": false,
      "properties": {
        "url": {
          "type": "string",
          "pattern": "^/",
          "description": "The preview page on the site. Leave it out and there is no Preview button."
        }
      }
    },
    "deploy": {
      "type": "object",
      "additionalProperties": false,
      "properties": {
        "skipCiForDrafts": {
          "type": "boolean",
          "default": true,
          "description": "Add [skip ci] when saving drafts, so they don't trigger a build."
        }
      }
    },
    "actions": {
      "type": "array",
      "description": "Buttons in the sidebar that start GitHub Actions workflows, e.g. publishing the test site the editor is on to the live site. The GitHub App needs Actions: Read and write.",
      "items": {
        "type": "object",
        "additionalProperties": false,
        "required": ["label", "workflow"],
        "properties": {
          "label": { "type": "string", "minLength": 1, "description": "The button's text." },
          "workflow": { "type": "string", "minLength": 1, "description": "The workflow's file name (or id). It needs a workflow_dispatch trigger." },
          "ref": { "type": "string", "minLength": 1, "description": "The branch to run it on. Defaults to branch." },
          "inputs": {
            "type": "object",
            "additionalProperties": { "type": ["string", "number", "boolean"] },
            "description": "Inputs passed to the workflow, always these values."
          },
          "confirm": { "type": "string", "minLength": 1, "description": "What the confirmation asks. Defaults to naming the button, the workflow and the branch." },
          "url": { "type": "string", "pattern": "^https?://", "description": "Linked once the run succeeds, e.g. the site it published." }
        }
      }
    },
    "blocks": {
      "type": "array",
      "description": "Blocks this site defines for itself: HTML tags the editor should show as a small form instead of as source.",
      "items": {
        "type": "object",
        "additionalProperties": false,
        "required": [
          "tag"
        ],
        "properties": {
          "tag": {
            "type": "string",
            "pattern": "^[a-zA-Z][\\w:-]*$",
            "description": "The element, e.g. YouTube or aside."
          },
          "name": {
            "type": "string",
            "description": "Only needed when two definitions share a tag."
          },
          "label": {
            "type": "string",
            "description": "What the insert menu says. Defaults to the tag."
          },
          "edit": {
            "enum": [
              "fields",
              "table",
              "source"
            ],
            "default": "fields",
            "description": "How this block is edited: fields is a small form, table is the table editor (rows, columns, merged cells), source is the element's own HTML in a box with this block's name on it."
          },
          "attrs": {
            "type": "object",
            "description": "Attributes an element must have to be this block, and which are always written, e.g. { \"class\": \"notice\" }.",
            "additionalProperties": {
              "type": "string"
            }
          },
          "starts": {
            "type": "object",
            "description": "Attributes whose value must begin with this, e.g. { \"src\": \"https://www.youtube.com/embed/\" } — how one kind of <iframe> is told from another. Only a condition: it is never written for you.",
            "additionalProperties": {
              "type": "string"
            }
          },
          "preview": {
            "type": "string",
            "description": "Optional image address shown in the editor, with {field} placeholders."
          },
          "fields": {
            "type": "array",
            "description": "The attributes someone fills in. An attribute the file has but this list does not mention is still kept and still editable.",
            "items": {
              "type": "object",
              "additionalProperties": false,
              "required": [
                "name"
              ],
              "properties": {
                "name": {
                  "type": "string",
                  "description": "The attribute this field edits."
                },
                "label": {
                  "type": "string"
                },
                "placeholder": {
                  "type": "string"
                },
                "multiline": {
                  "type": "boolean",
                  "default": false
                },
                "from": {
                  "const": "content",
                  "description": "This field is what sits between the tags, not an attribute."
                }
              }
            }
          }
        }
      }
    }
  }
}
